clean_tweet,label
no snapchat selfies. no instagram selfies. no noth will not bad bitch week man i go &#128546;&#128299;,1
fuck wigger stfu,1
"rt my bitch bad, island",1
"""@bill215_: &#128175;&#128175;&#128175; rt bitch want act like nigga bad &#128553;&#128553;&#128553; shit aint cuteeeee"" nigga act like bitches..",1
hoe get beat 2... n nigga knw dey ah tell u i stay wit ah pistol n alway readi squeez,1
evil son bitch deserv everyth that' come,1
a nicca ain't shit day,1
one sick bitch,1
the ghetto thuge version tree life come soon...,1
i damn go ovum dea n get as blown&#128163; kno wat look like bitch play &#128299;call of duti frequent,1
rt you either gay straight talk bitch pleas &#9996;,1
shit trash lol,1
i'd kill bitch abl cuddl right now. ugh. sucker stupid shit. i swear.,1
shower rod hoe http://t.co/tdzxbl6isf,1
"and bitch.. even say love me, bitch. i pray crash like carolin ditch.",1
"lol sam said ""betti boop"" hoe &#128514;",1
rt aye least bitch hot box lmao,1
rt someon love bitch as someon love,1
whi i play scari pc games? cuz im pussi like scare shitless,1
&#8220;@whoscherry: ever met bitch fuck nigga pussi admit ?&#8221; a bitch bitch.,1
"y'all say ""imma make way farther you.""al want aye i'm gonna fun bitch suck a diiiccckkk!!",1
rt i wanna reason u look phone &amp; smile car run yo as hoe!,1
funni tweet ashi nigger,1
yo fuck pat still bitch,1
rt i wonder mani y'all hoe got homegrown sex tape onlin u.o.e.n.o,1
rt side hoe shall eat side dish fo ye ye eat -traprinthion 10:17,1
faggot,1
i'm vipperloid bitch:p http://t.co/tl2nfxorsu,1
im queer.... #mmm,1
lmfao watch brokeback mountain taylor cuz we'v never seen aha #queer,1
lebron warm jacket full bitch,1
they thought i make pussi nigga made,1
rt i love bitch throw shade. just confirm i'm someth right &#128514;,1
"all bitch love me, bitch love me, bitch love me. you ain't fuckin dougi &#128129;",1
hell perk hoe? thi bullshit,1
a .4? jesu take rt bitch go .4 mc donald's. fuck spot,1
realli hate hungri bitch put dick friends. swear yall get beat fuck up. ill show friends.,1
wish they'd teach tracee. rt chihuahua squinti eye shit. i think hilarious.,1
"rt teacher alway think slick, bitch subtweet class shit.",1
ain't shit pretti bitch momma anyon get drama,1
rt these hoe realli ain't loyal &#128514;&#128591; http://t.co/6u2kbykq2n,1
rt hoe thought over: http://t.co/jhaocx1mtd,1
sometim gotta settl averag lookin bitch wit good person prevent gettin cheat,1
"yes, sorri grant, i'm bitch i'm go ignor like libtard ignor major voice....",1
sloppi ignor pocket &#128176;&#128176;&#128176;come lil bitch i want sloppi toppi &#128069;&#128166;,1
i'll never let broke bitch influenc &#128564;,1
"come see me. anyon name ""swagner"" obvious pussi",1
i refus rt damn bitch alway talk shit draya!,1
"who? ok, right-w teabaggers, gun nut (like harris), hell, even fuck cops.",1
"lmao.. brutal nig can't get jobs, lol..",1
"rt that rocket blow remind time colleg i blew tranny. but defense, i drunk. both tim&#8230;",1
seriou question: white boy pull bitch bumpin?,1
life aint nuthin bitch money #icecub #nwa,1
rt rt want expos bitch http://t.co/mgzjpp0rf,1
&#128530; nicca fucc yu,1
jesu walk bitch,1
rt i spray clorox seat bitch use i ain't much trust femal sinc sam rothstein met ginger,1
"i slackin ice game needa cop watch , fuck instagram hoe &amp; press block",1
would i bitch i said yea never told i stay at?,1
pussi boi,1
bitch u got fuck,1
"""don't get head hoe overbites""",1
right pussi,1
pussi,1
"hey new follow *waving* welcom ion talk bout shyt tho, retard as thought pop head",1
"""@beenbasedb: http://t.co/luubgl9y5u"" 0 ring 0 mvp 0 bitch lol",1
pretti motherfuck pull bitch like,1
rt dese bitch ain't shit i get em high feed em dick,1
nigga payback' bitch..!,1
"""i know shoe dirti fuck, whatever, bitch. you call!"" like, negro... one first thing look shoes, dog",1
rt sum u bitch old braces....,1
retard lol,1
lovin' pussi pic,1
say love bitch much i'll kill yo as front,1
rt a girl know bitch like boyfriend &#128564;&#128080;,1
"rt you mine mean respect fact i want talking/chilling, anyth bitch use like you&#8230;",1
mickeyblowsyourmind: want skype group bunch offens new york citi queer folk me!... http://t.co/bpgdvs8qd2,1
rt u ur boy discov hoe http://t.co/3tk3usclwd,1
&#8220;@_dmill_: &#8220;@1blackmigo: kyri fast bitch ball&#8221; look like lol&#8221;lol i wish,1
"rt answer phone hoe, i heard boutcha",1
&#8220;@m_rad: you bitch fat as &#128514;&#8221;onli way live u young shit gonna get old tho lot dent,1
"""@lolaaisdope: lmao fuck snake bitches"" em",1
surpris bitch &#128526;,1
lmao dog type let faggot tri deciph it.,1
rt we put redneck white hous gonna camo house. &#128521;&#128514;,1
hitman holla v charli clip match-up bittersweet. shit' gonna cold cu hitman holla gonna work last battle.....,1
"wonder mani us citizen join isi listen joe scarborough trash ""black president?"" good job joe!!",1
&#8220;@darkkskys: bitch set hoppin like bitch get life u get beat lmao&#8221;,1
sub tweet nig?,1
&#8220;@royalriahh: fake bitch i want hugs&#8221;,1
rt i got bitch geekin sneakin cocaina cross custom -,1
godli u fuckin redneck peckerwood.,1
bitch &#9995;&#128514;,1
"i know feel shit, believ me. i born heart la. it get anymor ghetto",1
my homeboy got hoe number hous arrest ... said that' good ask go anywher,1
"""all bitch want baby, i want children.""",1
no fuck fuck song wtf r u talk about. ye fuck i bitch,1
motherfucka tryna hate whip act like got cooler interior/light speaker hell nah bitch boy http://t.co/trbopwkaug,1
so fuck thirsti championship welcom fuck traitor open arms.... haha fuck heart as pussi organ,1
rt thi life nigger,1
"rt ""she' realli nice get know her!"" = she' bitch get use it.",1
aha welcom niggah &#128520;,1
pussi caus wars.,1
i'm lift i'm stiff bitch,1
rt i fuck yo bitch get mad noth new i fuck everybody' bitch #thesethotsareforeveryon,1
rt invest curtain bitch,1
rt my #tbt i learn english jabroni big bird i break fuck neck http://t.co/vdpiq8zuxo http://t.co/4&#8230;,1
anoth bad bitch fuck hour anoth cigarett anoth nut anoth shower,1
juici j can't say ratchet pussi remember?,1
i everyth except trust hoe,1
"rt when come nudes, trash, got big titti http://t.co/1weypg8r",1
"rt ur wack bitch sell pussi $65.00 , life mom homeless cut lies&#128521; http&#8230;",1
"ion pay pussy, pussi priceless.. i go fishin i ain't pisc",1
"rt ""if hoe excit you, still lil nigga"" &#128581;",1
"bitch caus u want fight show up, tryna make bet shit get yo friendli as my twitter",1
rt damn.. hotter bitch,1
rt as bitch rt aaron hernandez' girlfriend lie grand juri 29 time http://t.co/k6x3dukhtf,1
these la bitch thirsti hit singl,1
these nig like say miss old vice,1
carl tri eat pussi big as nose fuck shit,1
rt hoe swear boy,1
hoe shit,1
ain't bitch.,1
"rt die slow bitch ""@thotcho: that&#8217; rt scari accur http://t.co/dx79nxkll9""",1
rt we gotta get rid trash as alex smith,1
bitch hit dm nigga aint dm back,1
"final back behind sticks, visit bitch #vbar #stmarksplac #eastvillag #nyc #richmahogani http://t.co/piubuqxb9i",1
&#128563; rt &#128557;&#128557;&#128557; hoe selfish,1
"&#8220;@concretesledge_: gwyneth paltrow ugli as big bird look bitch, shut fuck up.&#8221; &lt;&lt;that' pretti much in your face! bravo!",1
i get nude bitch &#128526;,1
"rt you niggaz get emotionaaaal, you remind bitch!",1
"rt hoe year-round, yeezi taught",1
"im wearin one walmart jacket around walmart, ghetto? lmao fuck it.",1
&#128514;&#128514;&#128514; real rap fuck bitch lay day that' realli disrespect like bitch u feel throw coming&#128530;,1
"rt ""@1stblocjeremiah: yu ah hoe""lmfao,",1
"rt ""ate pussi first time today. all i say ... i think i may new favorit food""- michigan",1
sockin bitch mouf,1
bitch going?,1
he trash concert anyways. rt dude y'all fraud hell y'all go j.cole concert fw music.,1
"&#8220;@bigmamaatee: there' differ actual crazi &amp; aspir crazy&#8221; real shit . i can't stand ""fake crazy"" bitch",1
oh i see. part giant govt take eh. stockboy joke representative. #dumb teabagg,1
sike naw i love big smelli hoe doe,1
"the pilgrim high fuck, like ""let kill big as bird eat billion thing",1
no le 3 bad bitch bed time...,1
might one dont bitch,1
"i work done day get it, everybodi els scramblin' sunday. day rest bitches..",1
i'm fuck around two bitch never made hoe mistress,1
rt bitch got mani teeth mouth,1
"it funni bitch nag me, ju mad cant",1
these nigga pillow talkin that hoe shit,1
rt so y'all nigga realli love hoe nigga qualiti huh...sh roll blunt better wifey now&#8230;,1
money can't buy love i pay pussi,1
my problem i love bad bitches.,1
rt come fall i'm cuffin side bitches. y'all y'all time whole summer,1
not play game bitch,1
ya damn right nigglet! :d,1
i think i read worst interview ever. lee castro one 2 dope bitches. neither one two belong media.,1
rt how bitch how? &#8220;@_vontethekidd: how ok? http://t.co/tbm1dil55n&#8221;,1
i alreadi know wilson gone hoe later let gone get ammo,1
ibuki&#180; shave pussi finger fuck tight littl rosebud as is&#160;destroy http://t.co/kpxrszvd9k,1
&#8220;@leynachristina: i'm drive insane.&#8221;fag,1
tell bitch gtfo face fa reason,1
rt niggaz bare back everi bitch here&#128530;,1
i get money i ain't worri bout hoe,1
"them shoota grandmoma house, i ain't round bitch minut",1
"i found ""boom, boom, boom, waaaaay ho"" girl. how fuck someon sing 5 year progress all? http://t.co/o6r9byt5d",1
fck? dem bitch alway got sum shit wit them....,1
"bitch said ""booki spend night week"" wait.. what? got fuck lol",1
put tit away ginger. arnt u like 7? isn't past bed time? fuck bitch.,1
"hittin licks, get outta that? you &amp; yo boy pussi cats!!!",1
"drunkenli get free 3d print bracelet say ""fake ho""",1
"i'm defend ray rice doubl standard bitch, ain't http://t.co/plkfb3lnem",1
"briahna told best advic i ever gave ""aint noth cut dat bitch off"" lmao.",1
&#8220;@highclasscapri: lmao definit &#127814;&#8221;&#128553;&#128553;&#128553; i bout say front bitch shit freeway,1
rt lee hoe een gepest jongen zich probeert te verdedigen. ingezonden brief volkskrant. #pesten http://t.co/aod&#8230;,1
"women use nigga time monetari purpos gain, bitch wanna buy sneaker i ain't turn shit down.",1
"rt fellas, guess what.. we like ask look mean. it' call ""rest bitch face."" we just look thi w&#8230;",1
hang guy make hoe,1
rt girl realli made hoe kool twitter,1
"rt not today, bitch. not today rt soooo ur black feminist. u know pointless i&#8230;",1
i'm bouta let bitch play none family. it matter i fuck not.,1
pull trigger bitch,1
and i like yeah bitch,1
tell yo bitch stop call famili ! http://t.co/6zwo2a5wgi,1
"""i got bitch set like jada picket..queen latifah ride round niec bitch titi""",1
lol brother fag mann,1
subtweet use hashtag oomf what' differ :p jk jerkin' yo dick ya nigger faggot.,1
all ofay got left da oscars. better enjoy dat u color folk get dat too!,1
favorit bitch pic flirt nowaday,1
ur bo as bitch,1
what fake as hoe? i'm gone fought today. gimm nigga hand back,1
rt the reason high school fuck hard ned never made guid anyth past 8th grade. you feel me? fuck&#8230;,1
"""shall i compar thee summer&#8217; day? no, summer&#8217; day bitch.""",1
fuck yeah hot big blk boots. thi scalli lad would get it.,1
when see super bad bitch happen citi feel need shoot shot.,1
rt fat hoes. belli shirts. die now.,1
if know guy newborn babi fuck tri talk him? desper as hoe,1
rt everi time bobbi bitch come,1
rt lmao...........poor pussy!!!!! http://t.co/urjndmgdrj,1
bitch dat yo sahara desert as,1
how ugli as nigga get pussi ?,1
nigga needa stop wear mk that' bitch lol,1
did say tastiest cut cunts??,1
would faggot surviv tj?,1
you bbw shit get tf planet. take stud hoe too.,1
lmao wallah nasti bitch,1
"rt befor cover #ir misdeeds, creepi littl leprechaun john koskinen cook book teamster &amp; freddi mac http://t.c&#8230;",1
take bitch reciev head mom,1
thirsti hoe &#128129;,1
&#8220;@taylorsimonee_: i tend sens bitch older me. that' sad.&#8221;,1
so let faggot alreadi cri sleep,1
&#8220;@rojustdgaf aren't tho bro? rt i hate nosey bitch....&#8221;som other,1
bitch,1
rt hey hoe,1
"done act like littl bitch. my 5 year old nephew realer scari ass, sunset time u dumb fuck",1
"rt gotta eat pussi good forget dick come next. have talk like ""he brought dick too"""" &#8230;",1
rt you retard say birdmsn go hard.,1
know i llive stupid cunt &#128014;,1
bitch suck dick tri give sugar bitch get,1
did one biggest hoe around realli retweet that?&#128530;,1
slim hine lil bruda ainn bout bitch yu figur,1
caus he faggot,1
nigga ain't fuck champ straight bitch bout shit # bitch made!,1
"so i swore school closed, bitch open i'm home &#128514;",1
rt deletin emoji nigga/bitch contact name co mean shit anymor &#128514;,1
"hahahaha, aw nut... we tri captur cunt",1
"""you yo boy pussi cats.""",1
i like herbal tea bitch matter anyon els does.,1
nigga told bitch made &amp; real nigga kind real,1
rt thank ignor faggots. i'm lock outsid,1
rt whi y'all' ain't nun fat bitch jump me! yall trip&#8252;&#65039;,1
i know lot use as hoe want bread wheel nigga go grind bitch&#10071;,1
i like bitch &#128184;,1
fear queer,1
rt i wish sombodi get hoe away,1
rt &#8220;@vaientinescards: http://t.co/y75aw0olm3&#8221; ooooo give one hot pocket hoe #aamu,1
"i heard rumor vile, hideous, traitor bitch name pelosi parad around w/ illeg alien vet get shaft. #bloodboil",1
"where bad bitch at? and ""bad bitches"", i mean ""tacos"".",1
"""@dgotbricks: what happen vixen ent bitches"" got ran threw side like foothil bitch",1
oh hell act proper live richardson much finer hoe ducanvil,1
&#8220;@__idonthaveone: my friend insensit bitch &#128514;&#8221;,1
rt whi hoe wearin flower around head. i hope bee sting ass,1
"rt after long day work, bitch wunna rest foot lol &#128514;&#128129;&#128524;&#128176; http://t.co/2rhn5hpasb",1
"you ain't got job, diploma, money, bitch parent give money weed, yet we need act like adults??",1
"thi bitch ask pant sagg , cuz dey tryna hold bandz &#128184;&#128184;&#128184;",1
i hoe hoe snapchat,1
bet.... pay back bitch,1
rt even young age hoe ain't loyal http://t.co/omwaed2pcj,1
payback bitch bitch livin debt,1
ima fuck nigga omar weed browni,1
rt bitch tri kill kendrick lamar' vibe?,1
&#128514;&#128514;&#128514;&#128514;&#128514; oh gosh cute?! fa la la la la la la la la bitch &#128536;,1
"listen latina woman talk babi daddy' and""beat bitch asses"" make sub 9am worth it...a littl bit",1
omfg rt your foot bitch rt whisper someth dirti ear &#128523; http://t.co/xriykfgg3q,1
rt i never bought bitch....,1
if sneak diss &amp; i come tryna address initi issu &amp; say ain't nothing... you bitch,1
"""@talibanshawtyy: nigga whole hoe cuz"" couldn't said better..&#128588;",1
give ah fuck ah bitch ah nigga!!!,1
"washington post call presid ignor i ask racist ,angri ,bitter, bitch look mirror!!!!!!!!!!!",1
smoke good weed bad bitch,1
"hahahaaha teacher real thots. she said ""you need stop act ghetto caus cute""",1
"you'r killin' man! &lt;3 not conserv racists, like nbp hate honkies.",1
pussi what?,1
"it' octob babe, hoe anymore.",1
rt bitch fw old enough get id &#128514;&#128514;so tell &#128129;,1
rt #frasesdeunamadremexicana bitch son lol,1
"hoe shallow, shiesty, trifling, knew that.",1
these bitch alway trippin,1
&#128583;&#128583;&#128583;&#128583; y'all femal let sink min? moment silenc get y'all bitch think right? http://t.co/cdn0deycko,1
&#8220;@erickruiz45: i want baddest bitch world right lap&#8221; &#128514;&#128514;&#128514;&#128514;,1
"you boy sure come wit crazi names. in day, never talk faggot",1
haha ya hit hoe right,1
i gotta get da gettin good nigguh,1
yassss bitch!!,1
"&#8220;@draketakecare12: you don&#8217;t listen i talk, mayb you&#8217;ll listen i walk.&#8221; that bitch still listen",1
must sent bird call i get shit,1
thirsti hoe &#128129;,1
rt y'all makin nigga microwav dinner. meanwhil eatin anoth bitch homemad dinner,1
"#degenerateartist know words&gt; bo jingo dangl fan slang ho, ting pang lick drum swing flick alarm bic&gt; but can't hear fire you?",1
"""@thegamerkingkev: i wonder girl gave head 24 boy drink magaluf twitter"" probli send nude fag",1
left nice littl messag inbox delet comment call bitch &#128514; these&#8230; http://t.co/qruvcvnepv,1
there' gotta like 20 white trash motherfuck live hous i think job,1
"rt when tupac said ""i ain't killer push me, reveng sweetest joy next get pussy"" http://t.co/ffpu1w&#8230;",1
ye &amp; rt is ok beat bitch tweet nah?,1
"rt never trust ""y'al cute"" as bitch &#128554; wait strike",1
"lmao rt post away ""bitch"" i'v seen meme word offer regard honestli care.",1
you hoe u eat candi corn,1
rt true life i'm emot clingi bitch,1
"and girl pussi ain't shit me, babi girl roll get high",1
don't tri pull fake friend shit bitch.,1
gresham road soldier bouldercrest soldier i told bitch quit caus i'm never gone propose&#8230; http://t.co/fvojgh6bp8,1
niggah though daniel! lol,1
these bitch want next best thing,1
bitch shut fuck follow u say nigga,1
lol yeah bro good choice. but bitch love foreign whip person decis,1
"thi bitch need get right , wid",1
"shut fuck up, wack fuck. garbag mohawk faggot, stop make music shovel snow scrub.",1
rt if littl bitch http://t.co/92flicl627,1
"rt yall want foreign bitch sooo bad, cant even pull local hoe",1
"&#128114;&#128069;&#128166;&#128149; - &#128514;&#128557; oh god! thinccin make laugh, use stay talk shit 3rd period, cute, &amp; bitch &#9994;&#128514;&#128557;",1
oh.... trash say... thi trash gonna keep drive thru ky.. &#8220;@corey_emanuel: trash. just gotta ignor her.&#8221;,1
rt thi niggah said lip dri as hell lmao &#128514;&#128514;&#128514;&#128514;,1
bad bitch thing i like,1
these bitch man love harass,1
bring yo bitch as town east mall let know u bitch!,1
life fuckin short free bird,1
thi bitch need get slap http://t.co/kncwbpc8ez,1
"""if love hide yo bitch keep shorty.""",1
that bit donovan got dvd' droppin see ya lha bitch,1
bitch mob bad health,1
they bitch as nigga,1
"word rt and pussi rt and snack rt ladies, keep beer (cont) http://t.co/ssb5erhd",1
"rt ""@i_dontkiara: pussi dri 24/7 &#128530;"" http://t.co/ypvntydu28",1
one bobbi bitch hot nigga?,1
"rt science, bitch! #thewalkingdead",1
"you never heard ""i think weed poisoning"" caus dont exist hoe",1
rt charl manson' fiance difficult time plan honeymoon. charli can't surf.,1
he' trash,1
"#porn,#android,#iphone,#ipad,#sex,#xxx, | #korean | korean girlfriend pussi http://t.co/od1mquudnn",1
"heeellllooo ""@__ayoobreezy: if bitch keep hit nigga phone... it' he' still entertain &#128175;""",1
thi girl nastiest skank bitch i'v ever met. do not trust her. she fugli slut http://t.co/7su1uifun,1
"""@samjlayman : holi shit, freddi highmor charli chocol factory"" me: *roll floor, laughing*",1
melo got bitch east,1
"rt drink bleach bitch! ""@aubreychester: if you, youda done thing. #teamzimmerman""",1
eat bitch,1
&#128557;&#128557; rt welp rt the prettier bitch usual lose lol is scienc,1
"cancer hoe y'all pray peopl it. http://t.co/4xgeqmrzq5""",1
rt tweet ever offend you: 1.) im sorri 2.) happen 3.) 1 &amp; 2 lie 4.) fuck pussi,1
foreign iphon imma call goth hoe http://t.co/0iex8q4wml,1
&#8220;@tryhardsilva: quot weezi verse&#8221; like bitch as aint got shit,1
de hoe silli goose',1
rt i wish bitch would tell someth i know my nigga. girlboo,1
"rt brother said ""black girl pussi tast like attitud arguments"" lol",1
catch fuckin tonight #nolinenowait bitch well... #meetmether http://t.co/zqvgmlzqf,1
"rt ""you get bitches"" rt take care mo overr album releas last 5 year",1
crazi bitch,1
"&#8220;@almightycboogie: ion wanna hear it, hoe faker momma dee' teeth&#8221;&#128128;&#128128;",1
bc i got mani bitch &#128514;&#128514;&#128514;,1
young thug call bitch twin track. i even know mean i'm definit bout start call bitch,1
rt i like good weed &amp; bad bitch dat roll,1
i grown time i turn 16 wit grandma nigguh,1
these hoe love crewwww &#128564;,1
the major hoe think shit stink.,1
alreadi kno nicca,1
"mother fuck everyth got go today i'm go vega hours, bitch.",1
rt diii bitch &#128527;&#128158; http://t.co/gwkbq3l0s4,1
"rt i pretend like i'm cold heart bitch cut instant without second thought, actual i&#8230;",1
rt #fellas: would shit bitch ask like biggi skit? + i'll take dick go home.,1
fosho niggah il real busi late,1
"i hope trip fall pussy, tunechi",1
"thi exactli bitch end dead rt told stop fuck , i hope rain bitch. http://t.co/2fuxrzevtp",1
becom retard,1
wow i swear i'm gonna cunt punch,1
gave dat bitch da spirit dragon,1
i bitch face bitch voic match kinda hard make friends.,1
i hate nosey bitch like mind yah busi,1
"in class still drunk last night broad present chipotle, bitch i live #teas #feedm",1
rt scorpio aka hoe season right around corner.,1
chri faggot,1
"rt &#8220;@___tamm: shawti fine, breath stank...&#8221; do da heisman dat hoe &#128514;",1
rt bitch ocean this?? http://t.co/ylkr2gej1z,1
all de bitch know nigga.,1
"i'm dick ain't even got ya strap on, pussi",1
hoe,1
i swear hoe *aint got noth * &#9996;&#65039;&#128522;&#128591;,1
"7 pound never fail make cry. im bitch, i relat",1
"can't let nobodi play gta, bitch like use ya ammo n gettin ya dude kilt cop",1
"""@lcistj: bruh, stud keep think i'm soft hell. ask ya girl mani time scream bitch. oh okay. stfu."" bye hoe!",1
my walmart tee' count designer? rt these nigga hoe design cloth &#128557;,1
"sweetheart honestly, bitch specialti",1
as littl twat*,1
realli ain't nuttin cut bitch,1
my pussi popz sever,1
nicca hate nicca jeezi ... #realtalk,1
13% shi 65% bitch 22% homosexu,1
"neverrr, play stupid i'm far it.. you bitch might stupid. but &#128581;",1
smfh rt trash..slow fuck..cant even get nike releas,1
mr.nvr get pussi u virginnnn,1
"they look tom bradi go tge sidelin like, whatev bitch. lol",1
"#porn,#android,#iphone,#ipad,#sex,#xxx, | #anal | blond tranni as fuck http://t.co/80arx0qjxz",1
fucken pussi,1
piss i see littl liber faggot wear che guevara shirts. move ur as cuba. http://t.co/culwvpcpa7,1
"free 5iiiv nigga, let dog out. moma said pussi cat insid dog house! #sb4 #gang!! http://t.co/e8baxoypgg",1
bitch i'll fuck,1
"run game 5 year guess that' foot hurt , wonder bite bitch teeth hurt &#9995;&#128175;",1
rt hover parent one bitch children' dependence.,1
rt i use word cunt loos,1
"rt ""playoff hockey sucks."" dude, snickers. you'r retard hungry.",1
rt don't nigga want broke as bitch &#8252;&#65039; crazi bitch better broke as nigga &#128056;&#9749;&#65039;,1
guy say bro hoes. i say food dudes.,1
alabama tho. so roll tide bitch,1
"gotta love tanner country, hoe &amp; all,haha!",1
i can't talk anyon go answer little.phon call littl bitch low bathroom foh,1
"cruisin round street 64', jockin bitches, slappin hoe",1
that broad 7 day moe rt what earth this? rt nigga rt rihanna prolli sexiest bitch earth,1
"my cat roll said ""let go run game 21, bitch"" http://t.co/6kjgd0z1x2",1
bitch&#128545;,1
don't bitch.,1
i wanna someone' bitch as boyfriend right . but head playin game ya boi,1
that nigga john ain't ah real older nigga forreal.. he let vick brotha bitch maplerow,1
"they hate you, know bad, must someth right , got bitch mad.!",1
rt life bitch,1
devil send worker get lately... pussi fuck boy tri harder.. can't let'em throw 1... 2,1
rt lmao brother rt oooooo let find shoot star i could wish bitch would http://t.co/9dqlu7dzri,1
freshman year i rememb like yesterday. i lowkey plot baddest bitch. but clown as nigguh swoop dat lol,1
#thatfuckmemo leav car window rain car look like hurrican katrina ran bitch,1
pussi mine &#128514; &#128526;,1
rt play pussi get fuck,1
"rt 4370 sunnyslop dr, memphi tenn 38141...come get fuck as lil skinni bitch, love read skinni &#8230;",1
"rt just i thought justin bieber anymor pussy, get arrest canada fight person who&#8230;",1
lemm find twitter beefin hoe,1
i'm readi bounc di bitch -.-,1
i got bitch nervou like virgin flirtin wit uncl mervin,1
lmao bitch think fanci michael kor,1
rt thi bitch fuck insane. &#8220;@twiterdeze_nuts: 2) sentenc describ 5 words?&#8221;,1
rt you hoe &#8220;@villagebae: i thought cute that&#8217; i kiss you&#8230;&#8221;,1
slap hoe rusti axe ash blunt as,1
"that bitch crazzzi &#128514;&#128514;&#128514;&#128514; #1976 pussy, #fixit !!! #scandal",1
these hoe alway gone thot around ever give attent time,1
&#8220;@_1kane: lmaooo i find shit funni y'all hoe ain't content work one nigga http://t.co/dbtcv0fbn1&#8221;that' bore,1
ima knock da pussi like fight night,1
"rt ""your becom real bitch car ride."" - john care whether fountain wayn make money tour",1
boozer trash,1
fuck bitch lol,1
"oomf got ""hoes""",1
follow ah bitch ig tho 1inkkofrosess,1
lol faggot hid moon bo help,1
i thought talm bout school wifi i gon say ask bitch &#128514;&#128557;,1
"like ""look annoy littl 17/18 year old ask ride haha fuck poser bitch ass""",1
im gettin start oh yeah got bitch,1
i'm 3 bitch &amp; 2 em mix,1
"rt bow bitches, chief http://t.co/35ossuuwnh",1
how i take style back nicca nicca take style way before.....preach &#128175; #rn,1
lmfao right!..rt you knew sidechick. stop hate hoe.,1
rt dese hoe actin,1
vagina flavor bacon bitch,1
fuck told bitches. http://t.co/dif6d6eyin,1
pussi cat,1
rt too mani bitch strictli reli looks. can't bring noth tabl 100 like iphon &#128514;&#128514;,1
the english kill leprechauns. thank god. annoy littl bastards.,1
butter get hoe,1
kill hoe,1
jungl fever favorit movie. dat white girl love dat color man thang. she take hard deep. drive dat girl daddi wild crazi,1
"bitch like "" i'm squirter"" thinkin pissin squirting? bitch 2 differ place",1
if i watch basebal i actual go met jon stewart. and fuck yankees.,1
"lol tweet ""bitch"" excess amount (for you) today. ok?",1
rt rt real nigga fav bitch nigga http://t.co/c7wp1bluuk,1
realli care bout di bitch. dick yo feel,1
"especi wee cunt walk tens time lol, sup wae shit? you 5 foot fuck all. tank motherfuck ars",1
