clean_tweet,label
jihadi streams: british #isi fighter identifi abu abdurahman al britani kill action. http://t.co/ksowd8rrck,2
the earli bird take nap noon.,2
i wanna cuddl boyfriend fuzzi blanket &amp; drink hot tea hair play i go bed.,2
course! win lose alway excit matches. spilt blood trash talker!,2
&lt;-- nude trash,2
rt &#8220;@jemelehill: ::faints:: rt she idea mani resum went straight trash http://t.co/d&#8230;,2
"thi sexi tweet. rt with 6-0 lead, #yanke turn matt thornton finish red sox 9th.",2
make drake disses&gt;&gt; rt cant wait call trash tell everyon b l u forver goat la,2
let' go sweep!! #yanke #subwayseri,2
review: the yank coming! a militari histori unit state world war i http://t.co/hv4k1yzach via,2
cardin score 1st. they lead 1-0 top 3rd bird base. #nlc #sfvsstl,2
"i know i'm hillbilly, anyth better big pot bean cornbread? littl hot sauc top.",2
rt share food mangia cake friend love food #italianproblem,2
lol i alreadi made it. i'm wait browni finish &#128526;,2
rt chicago refund $7.7 million made red light ticket issu yellow light shorten http://t.co/&#8230;,2
"lol find ""redneck"" oakleaf take",2
i get 50 pound bag dawg mutt,2
khloee' new backpack color last night! &#127912; http://t.co/tyndjcsq,2
"rt ""@salon: meanwhil texas: 19-year-old man face 5 year life prison $25 worth pot browni http://t.co/438f&#8230;",2
i want go pumpkin patch love bird make date rest u uncomfortable.,2
"rt i wrote whole game stori orpik shut ovi two night row. mani mock this. but really, &#8230;",2
"mata'i ngeli, alu polosi ho nifo..",2
oh yeah. and annoy damn duck calls?? they outta banned. duck horns??,2
"rt and watchin' eye / and makin' linguin &amp; clam body, i know it!",2
can't stop eat graham cracker,2
intern polic oper disrupt shylock bank trojan - computerworld: the guardianintern poli... http://t.co/khsv319gh9,2
intern law enforc oper disrupt shylock bank malwar - pcworld: intern law enforcem... http://t.co/xizrs7atwl,2
who'd thought redneck husband would claim hipster glasses? http://t.co/vv6mzpq4ju,2
"despit zebra red rocket special, portland beat jersey shore floppers.",2
onli good thing season. #firecashman .,2
"wait minute... bowyer caus yellow chase race rt caution, 15 #nascar",2
a squad dyke chola fear nobody. they wors cartel,2
a ghetto girl' best bet find work call center tri climb corpor latter.,2
thi cowboy redskin game hell game,2
"are sure that, slant? they'r plagiarists, idea i am.",2
&#8220;@kik2clean: brah wiz cheat &#128514;&#128557; http://t.co/oz2pndngj0&#8221; hair like dyke..... uh.. duh?,2
"""i'm gonna nip right bud!""",2
twinki unfilling. odd fill,2
"rt buzzfe male live citi buy meat plastic, mock girl use gun go hunting. who manly?",2
"""@socass_: dude rememb wop video? http://t.co/p3heuboqbu"" omg where did you find that",2
rt day 2 fxx&#8217; simpson marathon &#8212; &#8220;bart&#8217; dog get f&#8221; &#8220;last exit springfield&#8221; &#8212;&#160;will best consecut 24 ho&#8230;,2
girl wear color jean &#128525;&#128527;&#128076;,2
jeff luhnow blame astro blow red sox yanke -hc,2
rt absolut perfect day london! sun out! gona cracker wembley tonight ! yeaaaaahhhh!,2
i swear peopl clean offic switch side trash v recycl can purpos mess me.,2
where would life without god i'd probabl live in trash haha!&#128514;,2
school wouldnt give kid schedules... #ghetto,2
"#teabagg state like mississippi oppos minimum wage, child labor laws, unions, pro-scab, sweatshop work - pretti much #slavery.",2
rt sav nice love twat! :),2
feel warm fuzzies.,2
bruh... soo trash....,2
charli day?,2
love h.birds! use feed i live wa state. hv mtn s.ore,2
"twitter littl blue bird name larry, celtics, isu larri bird, stick ticker $twtr.",2
nope. super chocolatey yummi brownies.,2
random run dog ghetto,2
terrifying. #leprechaun http://t.co/447wgksvvg,2
california gang california trash.,2
ciara ghetto name.. well kinda it&#8217; &#8220;ashanti&#8221;,2
rt i'm hungri someon would send fli parachut browni attach like hunger game tha&#8230;,2
when becom cool ne stupid? thi teabagg debat slim fact best.,2
rt take trash night http://t.co/uhxtogp4jz,2
met woman tri feed crow brazil nut,2
cant yanke make last week moves??,2
#nowplay : the door - the wasp (texa radio big beat) #1069thearrow - http://t.co/r5wuxa9jb6,2
look yellow fever.,2
rt i mean sometim eat carton doubl stuf oreo option.,2
averag basic basic trash &#128514;&#128514;,2
"man, seriou shiner chara' sporting. yowza.",2
top layer trash.,2
"did everyon else' parent use refer power puff girl ""powder puff girls"", mine except retarded?",2
thank hun! haha,2
eat browni go gym... idk,2
jihadi seem upset locat jedah confer #saudi purpos #isi,2
shylock &amp; wongs: 3 incid democrat bigotri in 3 week - media mum http://t.co/rx8ynpg1yd via,2
"the ""yanks"" are coming: from disparag pride http://t.co/hoelpcbbg6",2
"mash potato , string bean , yellow rice , chicken &#128523;",2
"i hate ""chunky"" pasta sauce. keep peski veget way from me",2
is looser #colleg town #btown ??? if ye id like visit #iu #hoosier,2
rt thank perkin student section particip yellow out. we realli appreci it!,2
auto tranni,2
time start list il spook,2
notic trash notif page clean,2
rt when i throw away paperbal perfectli trash can: http://t.co/215e0h0ps9,2
*rub hand like bird man,2
"rt plenti kobe vs. dwight trash talk game, too. http://t.co/ycwfrv7syx http://t.co/trhyfjoiwc",2
"rt fox new mock victim ray rice elev assault: &#8216;i think messag is, take stairs&#8217; http://t.co/6tklgup2wh ht&#8230;",2
"perhap ezra miller first crack toward chang that, regardless whether identifi queer gay.",2
"bjergsen made full as rune page. i full as red quint i mean as reds, blues, yellows, quints. 47% as",2
rt the thing need life comfi shirt oreo #southernshirt,2
rt poont gotta trash,2
"old fella water froze funer home. got unthaw want help get pump go again, place spook man..boo",2
someon pleas bring goldfish cracker,2
met fan tri tell rivera best yanke time closer. wtf,2
i like yanke toinight -107 http://t.co/j4rhambu,2
money hoe cloth,2
rt the nfl equal season everybodi show glimps trash,2
"i upload video http://t.co/jhuuzpgr updat on uganda anti-gay bill: freemasonry, anglo-american influence,",2
"rt yanke offseason plan: sign sandoval, move a-rod first base, shoot teixeira throw corps east river. #y&#8230;",2
i planet ape king kong clip,2
rt i went colleg everi colleg got bird class u get ya friend sign u &amp; get a class rashad &#8230;,2
rt charli sheen ice bucket challeng right way http://t.co/ijs0b0vtoy,2
"char-broil #cod, yellow #rice, saut&#233; spinach artichok hearts. made love http://t.co/vwjwlghrgo",2
monkey see monkey realli abu,2
and gotta ghetto fool :/,2
"rt run differentials:met -14, yanke -32.",2
yay i like jacob color layout,2
"anoth major develop jihadi circles: al maqdisi, hardcor jihadi theorist ask specif relief &amp; aid workers&#8217; releas",2
rt it yellow. http://t.co/xb4dkwuoki,2
here go browni go! woof woof!,2
you'r say zebra goth?,2
"i know feel,wait,no i don't. perfect week would yank get lee #gosox #gopat",2
my auto correct make sound fob,2
the valu abu qutada&#8217; statement credenti jihadi circl impeccable. he&#8217; face trial terror charges.,2
i think i found normal roommat again! prais jesus! these current one get throat slit sleep!,2
you never surviv da color hood,2
rt met superstar pitcher yanke game wear knick hat #knickstap http://t.co/g5fqgte2s0,2
wasp egg,2
rt i betray i slit wrist http://t.co/8hnw9qewsm,2
yellow shirt hat turnt da side,2
rt your sole purpos make money. otherwis suggest violenc prevent polici actual work.,2
racist texa trash gwbush came wh numb rememb republican stole elect,2
"rt also part releas day gift (yes, get those!) ador bumblebe bear! #montlak http://t.co/sc3ajxcirb",2
foto: mimiblargh: ok pl consid this: kingdom birb (can u guess bird are???... http://t.co/nwjummewnj,2
"mt: ""@dockozlowski: ted cruz ""we proud wacko birds"". #standwithcruz #keepcruzing"" pun?",2
rotherdam #rapejihad coverup: young girl sacrif altar polit correct favor pf paki pedo gang http://t.co/rdgyg6gurv,2
rt the p72 derek jeter use hit walk-off singl final stadium at-bat. (imag via htt&#8230;,2
chink that better rug rat run around yah crib girl enjoy life lol,2
parent televis council: 'scandal' sex scene charli brown ok | http://t.co/y3gnt4l7vc,2
"well, ""dirti bird"" could middl finger, sinc phallic ""give bird"". not necessarili wobble-wibbler.",2
burrito trash,2
"rt call old fashioned, i'm sewn togeth magic birds.",2
janet jackson' nip slip #icon,2
grandma got rosta color dress pretti she better let borrow,2
imessag trash,2
thank jackass zebra,2
mean trash lol,2
washpost describ charli crist' bizarr obsess with fan between leg to stop sweat when asked/answ questions! dog,2
rt &#8220;@1bookieg: what i wish i everi time i day play flappi bird,2
"rt in fashion world ""urban"" definit mean ""stolen black people"" ghetto us, urban haha http://t.c&#8230;",2
i start wear beani,2
final got medicin crackers!,2
wth play missy? ........ mean seriously? rt thi movi gone trash http://t.co/8bippvuvzr,2
rt me: do sell larger size condoms? her: sir 13 gallon trash bags! me: *wink secur escort &#8230;,2
"don't dance, iggy. it' trash like music.",2
"#porn,#android,#iphone,#ipad,#sex,#xxx, | #desi | paki http://t.co/xxcdqvzi9t",2
woot! rt #yanke complet sixth seri sweep season fourth home.,2
i'll trade one car drift brownies.,2
"rt rise+rhym #snowpatricksday on am! wear green, danc jig &amp; sing live tune w/ me! http:&#8230;",2
"a light, tender yellow butter cake classic boil icing, tradit made burnt sugar http://t.co/xpqktltnkh",2
oh no! sorri hun. that sucks. hope heal fast. &#128533; #dancerproblem,2
i like gross yellow heat lamps. why?,2
i don&#8217;t talk trash regard sports.,2
wait brownies. i want brownies. someon hook up?,2
"rt &#8220;@ikeepittooreal: when trash bag full , bare tie it....&#128548;&#128548; http://t.co/otzfiqmwi0&#8221;omg!! sttooopp!!&#128563;&#128514;&#128514;&#128557;&#128557;",2
"rt: thank you, captain. it'll never same. #jeter#2 http://t.co/eie8d8c5cj&#8221;",2
morn trash http://t.co/xba6wwvo7m,2
lmao. bel ike nowaday,2
rt just eat anim cracker sacrament! #17andlovinit,2
"some black peopl live entir differ world everyth peach cream, apparently. take rose color glasses.",2
guy compani best year ever...und obama....conserv teabagg scum,2
who' downi like browni 4 brunch? need mimosa,2
"our ""disco"" use disast recoveri awesom browni point well built are. most extrem conditions!",2
rt to call martin baker uncl tom uppiti he' side major pure ignorance....,2
"my father born nanticok attend lehigh. i'm ct yankee, love pennsylvania dutch cook :-)",2
"#porn,#android,#iphone,#ipad,#sex,#xxx, | #teen | cuti lesbian teen toy slit http://t.co/zs05enjjwm",2
"rt i got gatorades, twinkies, rice puddings, pringles, cooki &#128525;&#128555;",2
all i ever want someon love deepli devotedli charli kelli love waitress.,2
absolut absurd even think call. #joke #zebra,2
that'd ghetto littl meal,2
yellow jacket ga station trash can the worst,2
matter ?,2
or get swept motown lol #yanke #tiger #mlb,2
rt gonna trash talk pierc say front best friend &#128514;&#128514;&#128514;&#128514;,2
rt oreo speedwagon #fatband,2
rt uncl leo find iwatch trash http://t.co/t7gcsmcylb,2
&#8220;@atrue_cowboy: truth distanc love bird there! http://t.co/1kqnw4lj&#8221;,2
isi jihadi discuss &#8216;buy and selling&#8217; yezidi girl as slave http://t.co/uopgipopw #tcot #pjnet,2
rt obama kill twinki #gonetofar,2
"&amp; al je syri tweet, volg maar, zij komt er vandaan &amp; zal je preci uitleggen hoe wat.",2
"post new song: """"guala"""" http://t.co/tbpouto6zr http://t.co/y1rpitkiaf",2
huge yanke fan....enjoy http://t.co/tkm8l9ti,2
"whi boycott racist ""redskins""? #redskin #changethenam #changethemascot",2
blast yesterday...sh even monkey bar tryna kill lol! http://t.co/31g1km56,2
stay warm &#10052;&#65039;&#127744; #beani #sweaterweath #booty4ev http://t.co/zptckqybam,2
"rt sonia never criticis kejriwal. kejriwal, trash everi leader, never criticis sonia. touching.",2
&#9733; best asian massag on the park slope --top rate spa &#9733; 718-622-0221 - 24 http://t.co/iucrwofdt,2
chik fil a. hipotl trash taco bell give run,2
#yanke damn. well joe move bullpen realli helped.,2
"new show announc lutsen, mn papa charli januari 29, 2011 http://artistdata.com/a/33ck",2
&#8220;@queendev_: my leav trash &#128552;&#8221;&#128557;&#128557;&#128557; u sick,2
johnni footbal trash man. trash. lol.,2
rt udoni talk big trash lance. lebron hold back.,2
rt i wake middl night chug orang juic straight bottle. sorri mom.,2
cooki sound wonderful.,2
#tbt love forev ling ling &#128115;&#128114;&#128152; http://t.co/kecfnjyrw,2
reaper drone pinpoint jihadi john http://t.co/ibsczelxx via,2
rt black american are wors off under bho http://t.co/k4iweugnyx well research article...bound elicit cri uncl tom &#8230;,2
peopl trash car love drive fast reckless,2
rt oreo 6' http://t.co/jx9dd9oahi,2
&#8220;@deuce1990: what laker kobe&#8221; trash,2
.@agie_sweet36 tri visit night real spook!,2
"rt in hope recruit more women, isi open jihadi finish school http://t.co/ykyfijzgsi http://t.co/a&#8230;",2
"rt now halloween fast approach pleas understand this. we culture, costum mock ridicule! http:/&#8230;",2
i'm refer second put vick slot play #trash,2
rt there' yellow write black jers ...,2
"my doctor offic retarded, ""we notic put prescript order, cancel it. give u call need refill, thanks!""",2
sheez yellow bone,2
"your mother look like tough-as-nail bird...i see got 1/2 from. nice food, too!",2
&#8220;@_lovecarolina_: my laker go trash season i can't wait &#128588;&#128079;&#128530;&#8221; :(,2
rt pnd vocal trash lmao,2
step take oppurtunity! #freshfac #iubb #hoosier,2
i'm gonna ghetto color stain sharpi ctfu,2
&#9733;@&#9733;@&#9733;@&#9733;@&#9733; grand open ! &#9733;@&#9733;@&#9733;@&#9733;@&#9733; top class &#9733; orient massag &#9733; perfect !&#9733;/ http://t.co/dmxplroaj2,2
rt i'm littl teapot short irish artist year #ama #emabiggestfans1d http://t.co/9o1zfvlezv,2
argie?,2
&#8220;@mannybdlopez: when open starburst candi get 2 yellow http://t.co/f0ddbfezb6&#8221; lmao brother,2
rt **wow* accord tweet obama must uncl tom? http://t.co/klcsgy9jpw,2
"""yaoooooooo mawnin yardies! &#128154;&#128155;&#128536;""",2
i'd kill meet charli sheen.,2
want it! i love gooks! awesom get it?,2
y'all got taxi right now? and i get oreo 5' right possible?,2
pacey told flash touch turn yellow black.. #whatwashedo &#128514;&#128514;,2
darki dgaf! rt gotta chill wit yellow #4thofjulyfli outfit man rt http://t.co/uimf6sdi,2
tripl fudg browni chunk ice cream #lifechang,2
intern law enforc oper disrupt shylock bank malwar - pcworld: intern law enforcem... http://t.co/xezf7cj5qt,2
"i see ppl say run train bird, parri thing, da i know..so look clariti",2
so real unreal lol #yanke #worldseri #27andcount #mlb #mlbtheshow12 http://t.co/tdmrbsnp,2
game 126 preview: houston #astro new york #yanke http://t.co/svg7diiczg,2
io.. lol osi tangi! haha tuku ho tangibl terryn! atunga ho fie lea lahi mai!,2
rt red hot chili pepper longest nip-slip super bowl half time show history.,2
live bird found elmo doll us-mexico border (from http://t.co/jch9hqvlpl,2
damn charli wilson still around?,2
"my son 9 still issu tie shoe he' barefoot time, case want know hillbilli status.",2
rt peopl realiz jig ?,2
rt just settl all: which came first chicken egg? the egg -- laid bird chicken,2
"also bird, city, math theorem. i make assumptions!",2
yeah that' suppos put trash can.... #rude http://t.co/molwf0pi,2
earli bird get worm right? hope i get job soon today! http://t.co/lvgfvbqkdz,2
"rt can kid say much parent pay everything? rt if pay everi bill, i can't complain abo&#8230;",2
thank charli #ff,2
rt bunch rapper boutta flood internet w/ trash remix,2
long name chang al memorabilia w/redskin name deem racist therbi illegal?,2
"lololol rt freddi still birds, doppz still wet man, harri still parry, salt",2
"rt gop nomine #magov charli baker' ""fisherman story"" fall apart. he deserv oscar play crying. http://&#8230;",2
yellow fin,2
rt i hope yanke game get rain tonight. it' go special atmospher game. jeter deser&#8230;,2
"rt a bird sing answer, sing song. maya angel #poetri #write",2
thi realli rt explod giant yellow ducks. you&#8217;ll appreci this: http://t.co/spohtpl8uv,2
trash show,2
rt how much coke charli sheen do?.. enough kill two half men i guess,2
"#blessjesu yes,#felt..and touch sol human stain impress leaf reflections.",2
rt i call 100gram sugar delight heart attack. it' #poptart #twinki &amp; #honeybun http://t.co/s6znlvlvli,2
why? you wanna gimm baby? you look coolie....it might could work lol,2
shade eric chavez' past gold glove! #yanke #oakland,2
i'd rather hear neal degrass tyson tell scientif mistak assumpt wasp... http://t.co/tlec4vkuyd,2
99 percent trash dump sea missing. thi good thing &#8594; http://t.co/cwc2lwcv3t http://t.co/y0kt02hlm1,2
infer tri ho nam. he not. he dodg it. he great leader.,2
rt parqu de atraccion abandonado en jap&#243;n. http://t.co/dn0jiid4f4,2
rt well sure heck know read. i'm read trash right almost everyth i'v heard web&#8230;,2
tranni,2
who wanna play pin da tail da color man' butt?,2
stop rt'ing celtic trash pleas,2
"cut porkchop, can pinto beans, small carrots, corn, celery, potato. cayenn powder + crush red pepper",2
"#iu make honorari student, id way cooler intern students. footbal card! #hoosier",2
&#8220;@notflappybird: tag friend suck flappi bird&#8221;,2
rt femal ig model person trash &#128546;,2
rt noth agenda. unbeliev dem fail use teabaggers.,2
i need yanke win pennant!,2
"i believ evolv whatnot, i find hard believ came ape",2
versac bird feeder,2
"lmao dude, said would get commit saudi arabia jordan! how crow taste? more proof full",2
"my teacher alway say ""ha man ever abus wife use marijuana? not unless hide oreo cooki deserv it.""",2
steak either. no hurri brownies. just pictur u post made drool phone. :),2
&#8220;@johnelhadleyjr: uncl charli got thru lip singing?!&#8221;haha,2
.@harmonica_b could wear trash bag she'd still stylish coolest human i know,2
"slavery, prohibit let woman vote... segreg jim crow laws.. etc etc day lol",2
i said middl school day ghetto way people... &#8212; i impress go... http://t.co/qypvikcrfi,2
so i cracker play guitar (thank ) saturday night?,2
rt &#128514; rt charli strong got 53-man roster nearli quickli texan,2
rt gun control talk gunrun eric holder board. we r planet ape,2
"rt give statement thought realiz make sense. at all. please, think abo&#8230;",2
my bird got headach &#128527;&#128530;,2
got chunki marmalad today great custom servic past 2 yr #postietweet #servicematt http://t.co/psengvyxrw,2
you like those? honestli tast like sole shoe rt that' shame.,2
where' part fat ami go err wop wobn wefo? #thingspeoplesay,2
you need iphon use stupid watch? appl grab peopl ankl shake money rube pockets.,2
finger cross you. if not? chug chug chug lol,2
they'r goooood. i want like savouri salti cheesi cracker,2
yellow spots?,2
"rt yeah kaepernick might bicep like greek god, dude look like conceiv probosci monkey http&#8230;",2
green banana better yellow one too.,2
"hi charlie, great day",2
"thi billi crystal tribut derek jeter crazy. i hate yankees, man... derek jeter.... #re2pect",2
&#8220;@hoppk92: sick trash talk cocki attitudes. #shutupandplay&#8221; ref take control need,2
"rt ""you'v got smelt lot manur sing like hillbilly."" #hankwilliam http://t.co/xkwon1l0nb",2
there' reason yanke want anderson longer.,2
rt !!!! &#8220;@rapaboutcereal: jay z vers trash. http://t.co/eyb3b08btm&#8221;,2
rt two jihadi argu over stolen m&amp;m' will make your day http://t.co/ufrcldiovx http://t.co/zukwj2ve2d,2
giant trash...their time over.,2
rt peep trash.. marsh mellow gener trash,2
"i know what' stressful, midterm flappi birds.",2
&#127867;&#127867;&#127867;&#127804;&#128153;&#127913; plu sheryl crow http://t.co/49kywznotu,2
"even though lil wayne' music turn trash, no ceil i am not a human be alway favorites.",2
nature' majesti beautiful! *melt butter* rt photo: rare blue-color red king crab caught alaska waters: http://t.co/ia5kfou2b3,2
"#blessjesu amo 3:3 can two walk together, unless agreed? #differentlevel",2
watch: excit isi jihadi get their yezidi sex slave on 'distribut day' http://t.co/n9exnuvhk #isi #tcot #pjnet #lnyhbt #gop,2
is yanke good mood today,2
lol color contact play out.,2
"cactu yellow lab chow mix too! hershey everybody' ""active"" buddy. cactu one special pup. she' angel.",2
#gouach #inktob #oldpaint #mt #tiki #wahin #surf #monkey #bright #happysunday #peac wishing&#8230; http://t.co/l73hik0iz8,2
new show:thursday jinxi broadcast moon made chunki blue chees know,2
we struggl colleg work ice jj fish make money trash lol. what world come to.,2
"""trash"" snd star would scrape ur team snd pro teams.",2
&#8220;@bestofads: rape? cannibalism? you won't recogn the origin version of these fairi tale http://t.co/prnj8efaoi&#8221; man wtf,2
ye true reagan first..ik wouldnt. while presid suprem alli commander.,2
"rt attack animals, last hous left lake, got color eyes...w known.! lol",2
#royal 2-1!! fantastic. readi tomorrow' sweep dispos o's. #yanke 4ever except month.,2
i cloth make look like redneck i tri best &#128514;,2
"but seriously, reason i use mega whatsoever. pure favoritism. also sweet fuzzi wings.",2
rt happi #blublood friday! off sit gang cb thi morning! join u 8 o'clock ho&#8230;,2
&#8220;@abstractlife: orton trash idc&#8221; ain't playing. trashlex smith sat kaep took spot.,2
rt #royal win!! kc 2-0 blank yanke take seri bronx! #beroyalkc,2
nobodi give trophi caus i'm old color #favstartweets&#160;,2
time find monkey term scripts!,2
"rt lmfao oh nah she keep it three hunna""@catoxx3: twitpic selfi u ho http://t.co/j4runfzrtx""",2
"thi mint browni recip made almond flour, coconut palm sugar, coconut oil, coconut mi http://t.co/xzzfdolzdn",2
rt instant mash potato trash &#128686;,2
"rt victory! #yanke outlast a's, 10-9 14 innings. eduardo nunez hero, oh yeah, first place still resid bronx.",2
"rt get readi nevada hump day real live camels, ostrich zebra - oh my! #nevadahumpday #&#8230;",2
"barry' (whitey) brownshirt run wild oakland. follow lead n.w.a., punk chant f police. http://t.co/9nburmtj",2
what say... i see bird it... lmao,2
....yeah....i think #injuns. i think #redskin #polit #alcohol #washingtondc .....,2
shout pullz cuz i kno i trash would kept buck... i swear everi i made ju cuz n actual bump dem,2
rt happi birthday cotton picker lol,2
would help other can't handl upper crippl plu moder taken consider it'll bad,2
but i callin da race card. ain't color podcast dare,2
i confess. i'm autist something. i thought #aerosmith #dreamon #ledzeppelin like yesterday....... #retard,2
rt shi girl cute,2
mean trash.,2
i'm realli phone kinda guy.. i actual hate talk phone &amp; text kinda trash also.,2
rt secretli yanke fan! you'll admit day !,2
you date color men?,2
"a homeless dog live trash pile get rescued, someth amazing! pleas share. http://t.co/szpstdxmn6 via",2
rt so glad charli agre carol cnn assault girl ok&#8230;,2
i #onslaught #vinyl i may get one now. their new lp avail armi green colour vinyl,2
rt studi bird closely. see spot female. it done. even limit bird watch skills. http://t&#8230;,2
free birds. lol,2
such trash episod walk dead tonight.,2
"thank charlie, happi thursday",2
i like peac that' bore i like fight i come ghetto u rememb p imposs,2
i got get trash make breakfast frau start laundri y'all good till i get back. cracker out!,2
my hair trash. i need put masqu it.. but take much energi i have.,2
rt thi jimmi fallon prank get ny yanke fan boo robinson cano amazing. http://t.co/xnzkzlly4g via,2
unpunished. thi view mani thousand year civilis uncivilis society.,2
rt charli sheen slam rihanna for reject hi fiancee: you&#8217;r a rude &#8220;idiot&#8221; with bad wig http://t.co/nchn9crlcj,2
rt don't know yanke fan listen kay everi night. absolut brutal. just nonsens blah blah blah blah. radio n&#8230;,2
rt hillbilli like sport to...,2
"""lol, cripple!"" - wendi davis. rt scientist creat remote-control chick studi shi penguin http://t.co/mt3b09slod",2
bath sphere: suspend orb tub not shi peopl http://t.co/ohv7xbr6wo #bath #design #weird yet #cool,2
rt for last week name crippl &#128555;&#9855;&#65039;,2
"""how draft gung-ho folk send afghanistan war zone show their... http://t.co/sr1zcehx",2
"""@soxdawg: rawr!! rt ""my"" sexi french scally. i love him! #frenchscal http://t.co/5idq3r5akz"" sexi scalli woof woof",2
&#128553; monkey mad,2
"rt feb 2015 jordan 4 retro remast ""oreo"" 314254-003 http://t.co/nboaxg1s19",2
rt *spit anim cracker* thi even tast like hippo.,2
"typic hitchen type atheist watch doc hollywood hate god, readi mock it.",2
"rt bizarr sport week cle. win game felt like loss,fail ex-brown qb' duel other, lose ho&#8230;",2
just watch llewyn davi doc. warm fuzzi abound &#9786;&#65039;,2
"rt ""mi bro made ugli chick festiv drunk he' known larri bird hit ""threes"""" &#8230;",2
"feel way new england patriot &amp; new york yankees. but unlik u, i'v work boston &amp; nyc. texa prison upgrad",2
"rt storybook end new york. derek jeter walk winner yanke stadium, http://t.co/prs2lwatk7",2
there' bird nest garag bird fli poop car. &#128529;,2
wa wonder yo espect add mo color tv station befo i renew di,2
"ha! i'm actual go see yanke game, weird sounds. my uncle' hous nj hour away.",2
jihadi john struck again. prayer victims' families. what #bounti hi head? time 4 2 meet allah,2
"rt pull dead bird garden. grate hot sun, wink rot eye socket.",2
barkley trash,2
defin wigga,2
got sole,2
wa finna slit eyebrow shop nahhhhhh. . . . . . . . . . . . . . . . . . . . . . . . . . . . . . . . . . . . . . . . . .,2
racist tx trash enjoy high along gop win substitut racist loss!,2
